{
  "schema_version": 1,
  "task_id": "drawbeams-fix-corridor",
  "module_id": "antigravity.drawbeams",
  "files_to_verify": [
    "src/Antigravity.DrawBeams/CreateBeamCommand.cs"
  ],
  "symbols_to_verify": [
    {
      "symbol": "CreateBeamCommand",
      "paths": [
        "src/Antigravity.DrawBeams/CreateBeamCommand.cs"
      ]
    }
  ],
  "diagnosis": "The command does not validate the selected beam input before execution.",
  "diagnosis_sources": [
    {
      "path": "src/Antigravity.DrawBeams/CreateBeamCommand.cs",
      "line_start": 20,
      "line_end": 26,
      "reason": "Input is used without the required validation."
    }
  ]
}
